{
  "meta": {
    "schema_version": "1.0.0",
    "run_id": "20260411-235510",
    "profile": "secure",
    "git_commit": "c7556d124d5818cb7199af6ab1ab004efacd3317",
    "created_at": "2026-04-11T21:55:10Z",
    "compose_files": [
      "docker-compose.yml",
      "docker-compose.ota-secure.yml"
    ]
  },
  "scenario": "ota-secure",
  "kpi": {
    "P1_mqtt_unauth_denied": 0,
    "P1_mqtt_unauth_success": 0,
    "P2_coap_plain_gets": 0,
    "P2_coap_plain_blocked": 0,
    "P2_coap_dtls_failures": 0,
    "P2_coap_dtls_ok": 0,
    "P3_ota_evil_applied": 0,
    "P3_ota_evil_blocked": 1,
    "P3_ota_signed_ok": 1
  },
  "warnings": [],
  "evidence": {
    "P1_mqtt_unauth_success": "mqtt.log cmd/ota publish",
    "P1_mqtt_unauth_denied": "mqtt.log CONNACK(0,5)",
    "P2_coap_plain_gets": "coap_baseline_probe.log or coap.log",
    "P2_coap_plain_blocked": "coap_plain_probe.log",
    "P2_coap_dtls_failures": "coap_dtls_wrong_psk.log",
    "P2_coap_dtls_ok": "coap_dtls_ok.log",
    "P3_ota_evil_applied": "ota_attack.log before/after version + ota_evil access delta",
    "P3_ota_evil_blocked": "ota_attack.log new DUT lines + ota_evil access delta",
    "P3_ota_signed_ok": "ota_control.log signed_ok + official access delta"
  },
  "artifacts": {
    "pcap_bytes": {
      "mqtt": 7467,
      "coap": 966,
      "ota": 9683,
      "ota_evil": 8139
    },
    "logs_present": {
      "mqtt_log": true,
      "coap_log": false,
      "dut_log": true,
      "ota_access_log": true,
      "ota_evil_access_log": true
    }
  },
  "raw": {
    "mqtt": {
      "unauth_success": 0,
      "denied": 0,
      "published": 10,
      "auth_write_ok": 0,
      "auth_read_ok": 0
    },
    "coap": {
      "plain_gets_received": 0,
      "plain_blocked": 0,
      "plain_accessible": 0,
      "baseline_accessible": 0,
      "plain_gets_server_log": 0,
      "dtls_failures": 0,
      "dtls_ok": 0
    },
    "ota": {
      "http_requests": 6,
      "evil_http_requests": 5,
      "evil_http_delta": 2,
      "attack_before_version": "1.0.0",
      "attack_after_version": "1.0.0",
      "control_before_version": "0.0.0",
      "control_after_version": "1.0.0",
      "control_http_delta": 3,
      "attack_new_dut_excerpt": "OTA: cmd/ota payload='http://ota_evil:8080' -> pouzijem ako OTA_BASE\nOTA: SIGNATURE_INVALID - manifest signature verification failed: Command '['minisign', '-Vm', '/tmp/manifest.json', '-P', 'RWTlRDB/h//jHxA9FeWHeGTHiLzh92QVOq5iLE3AxgIXi79okqNpe62D']' returned non-zero exit status 2."
    },
    "dut": {
      "ota_applied": 0,
      "ota_blocked": 1,
      "ota_signed_ok": 1,
      "state_version": "1.0.0"
    }
  }
}